id,tweet
1389891461466918914,"@RanaAyyub I am a kannadiga, what Surya is saying is ""Those monsters who are running a racket of hospital bed buisness must be severely punished"" They are the sickest minds and lowest scum. Proud of my MP."
1389891461466918914,"@RanaAyyub I am a kannadiga, what Surya is saying is ""Those monsters who are running a racket of hospital bed buisness must be severely punished"" They are the sickest minds and lowest scum. Proud of my MP."
1388488375439667203,"Desperation in Kerala as kin of COVID-19 patients hunt for ICU, ventilator beds  #Kerala #COVID19 #Covidsurge  https://t.co/ZKRPBkXUVP"
1390173965411250176," https://t.co/FtGTgD3Wi1 #OxygenExpress with filled oxygen tankers has reached Delhi from Mundra, Gujarat by moving swiftly through the Green Corridor.   This will ensure smooth supply of Oxygen for COVID-19 patients in Delhi."
1389780400646463488,"A BJP MP complaining to a BJP CM about a scam by BJP run BBMP deserves to be a mini Netflix series   In all fairness, I hope this eases up the hospital beds situation in Bangalore. On ground, there is very little change so far. Let's wait and see."
1388373087062798336,"@aajtak @ndtv @ABPNews @PTI_News @ANI @ZeeNewsEnglish please showcase some positive &amp; informative news like beds availability in hospital, @oxygen availability in different state hospital etc. Please don't scare us @h_n_patel"
1388331775412166656,"@dineshgrao Pls stop using this for your benefit. Come out to vaccination centres, hospitals and help... Zero political and official representation at health centres."
1389366425945468929,"2 critical #COVID19 patients died in Arka hospital, #Bengaluru due to low flow of oxygen,since hospital didn't get back 35 #Oxygen cylinders sent for refilling. Now 15 cylinders have reached,20 R on the way.45 patients r admitted in the hospital, situation under control as of now  https://t.co/ptqfP0TRk2"
1389899992354021378,patient name- Geetha R BU866566 AGE 51 Contact person  bsavaraj 098809 15666 O2 level is at 70 and dropping need oxygen cylinder atleast in Bangalore Anekal @Tejasvi_Surya @CMofKarnataka @Raghu_Dixit @Dhananjayaka
1390009610749190144,Verified just now +91 81233 14373 Oxygen concentrators in Bangalore.  95k 8th May delivery 75k tomo delivery after 5pm #COVID19 #COVIDEmergencyIndia #covid19india #bangalore #oxygen  @covidres_in
1389199375767769095,"@Central_Railway @RailMinIndia @PiyushGoyalOffc My Tauji,retired guard, admitted at Rly Hospital Jhansi SPO2 55-58! No Ventilator available. Hospital want us to shift to different hospital !No ventilator beds available! No help available.Why is Rly hospital such under resourced?"
1389073989662695424,"@arvindergujral Aveksha hospital(ms palya), female ward with ventilator, one bed is currently available. Call immediately +919632544445"
1389467701576404992,"Serum Institute promises 11 crore Covid-19 vaccines to states, private hospitals  https://t.co/QGojebjnFV"
1389467514170601474,"Like all other schemes announced by @narendramodi and promoted by his chamchas @BSYBJP and @Tejasvi_Surya, 18-44 vaccine also is far away from reality. I searched all the districts neighbouring Bangalore as well. Not one centre/hospital has availability. Zaroor kuch socha hoga!"
1388367822980407298,#AndhBhakt @PMOIndia @narendramodi  @SrBachchan @akshaykumar @KanganaTeam @CMofKarnataka @CMOMaharashtra @CMOKerala @TelanganaCMO  So much fund raising and aid we are getting to fulfill oxygen needs. What will happen to the funds allocated by central/state govt for oxygen supply
1388385440516874240,CM Shri @BSYBJP launched #COVID19 inoculation drive for those in the 18-44 years age group. The State Government is committed to ensure that all above 18 years get vaccinated. Citizens between the ages of 18 and 44 will be given free #CovidVaccines at government hospitals.  https://t.co/jJN8B2FRMW
1388421443621330947,No vaccine 💁 No oxygen💁 No medicines💁 No hospital bed💁  Story of India    #Vaccine_enga_da_dei
1389169830775853060,30 LIVES AT RISK AT MEDAX HOSPITAL - BENGALURU!  They will run out of oxygen in two hours.  Please help!   #Banglore #SosBanglore  @mla_sudhakar @drashwathcn  https://t.co/Gc4u3fWCCF
1389169215957995523,The heart-rending news from Chamrajnagar Karnataka. 24 patients have died due to lack of Oxygen supply &amp; medical supplies.Ths is murder by designed negligence of Yediyurappa Govt.The life of common man is so cheap for this anti-people govt #ResignSudhakar   https://t.co/MAjBBVH4x7
1389965610365317123,"An educationist, BN Dhananjay,  has come forward to offer his school to be converted to a makeshift hospital, free of rental costs.   He, however, has one condition:   https://t.co/VzeqdgVpT6"
1388512973216358400,"@bhumipednekar is it possible to help this family find ICU bed anywhere in Delhi NCR... oxygen levels dropping.  Patient Name: Amit Rastogi Age: 42 yrs R/o 7/25, 2nd floor, East Patel Nagar New Delhi-110008. Attendant Name: Deepa Rastogi (wife) +91-8368272109"
1389997157122330625,"not sure if Aadhar and prescriptions to be shared to unknown phone numbers , they claim to be from a company called ""Portable Oxygen Cylinders"" and from place called Ooklha , they were speaking crude hindi , please save any innocent people from getting duped"
1389205181816991746,5.Preferred hospital:       (Pvt/ Govt): Any 16.Type of Bed Required:       (General/HDU/ICU/Ventilator) ICU/ventilator
1389651292985782274,"To everyone amplifying SOS requests, sharing leads, verifying sources, calling hospitals, getting vaccine information, sharing details about various things-  https://t.co/Yvc4TUYQ3G"
1389848806112382978,What is the time frame for installing 500 medical oxygen plants across the country? What is the penalty clause if not done?
1388753929614229507,"Family urgently needs ICU bed with ventilator in Bangalore. #Covid patient is Ankith Gupta, 31 years, Vijayanagar. Contact person: his cousin Mayur: 09980828001. SRF ID : 2952511346159  BU Number : 689860 @sajjanrajmehta @tinucherian"
1390155436528046084,"You criticize your leader for making you jobless.. Btw what was the job? Duping people under bed scam, medicine scam, oxygen scam! What not are you involved in. #BedScam"
1389561253400432642,@SonuSood sir request your help to get one oxygen concentrator please here in bangalore they are charging 5000 to 12000 which is too high and still not available
1390004540313722882,More hospitals request for oxygen as they face shortages @mla_sudhakar @BBMPCOMM @santwana99 @XpressBengaluru @NewIndianXpress @DHFWKA @sureshshastri06  https://t.co/jsPPsZkk3D
1388854022946185220,For hospitals in &amp; around Haridwar.   BHEL can help you with refilling.   I called all the 3 numbers and just verified.  Refilling only.  https://t.co/eQEXONFBgK
1389242285217382400,@COVResourcesIn #Bengaluru Need ICU/Oxygen Bed for Patient Oxygen Level - 83 Contact - -9620818126 No leads on your website!
1389585024333193216,"@as_resource The patient is admitted to GMC hospital Guhawati, but lacks ICU bed, on steroids, Heparin, and on antibiotic; Saturation 80-85 on Oxygen High-low at 15 Lt.  Cc: @himantabiswa"
1389453826948669441,Just asking. Aren't these expensive hospitals supposed to be equipped with oxygen generators? That's like riot police complaining they don't have batons and basic protective gear in case of any emergency !
1389599090716012551, https://t.co/B4JImEeFCH how can people believe BBMP if hospital beds are illegally blocked ?
1389451457389203459,"@LiciousFoods hi, as a vegan, I find ur daily smses offensive. I understand u have no way 2 know this. Pls remove me frm ur contact list. I believe in cruelty-free dining. Notice the similarity between a patient requesting 4 oxygen &amp; a fish trying 2 breathe. U'll #GoVegan too  🙏"
1389494896625471488,@ainvvy Oxygen isn't a resource that is an individual state's property. For instance Delhi has no oxygen manufacturing facility. By that definition can Haryana and UP declare that all the oxygen manufactured there should go to all their patients first ? Doesn't work that way.
1388918049705664513,@sonaliprasad07 9Ltr oxygen concentrator available Pintoo 9873391119  Verified Three ppl got from him. N.B. pls do not make any advance payment.
1388433746395762689,"Need a ventilator bed immediately in Merrut, Muzaffarnagar or Shamli. Patient is critical and dropping her oxygen levels. Name- indlesh Tomar age-55, contact no-9108367442 @TeamRLD1 @PJkanojia please help."
1390012094620176384,"Patient Name : Mrs Rashmi,40yr  Rajajinagar Breathing Difficulty 2days SPO2:86-88 Searching for ICU bed List of Hospitals Visited : S S Sparsh hospital &amp; 2 more Covid: Negative Attender Mobile No :  9980936726 Brother SRF ID:2952511945 BU Number: Not generated @TeamNamma"
1389451733835784196,#Ahmedabad #Oxygen #CovidHelp
1388454072575881221,Hospital fire in India kills more than a dozen COVID-19 patients  https://t.co/vflw3xjstc via @nypost
1388462545904693254,"#Breaking: 8 covid patients die due to oxygen shortage at #BatraHospital in Delhi, including a senior doctor, This is a Murder !"
1389102423893897217,Tragic news from Chamarajanagar in Karnataka.   24 patients have died in the last 24 hours due to lack of supply of Oxygen &amp; medical supplies.  This when CM Yediyurappa and Health Minister keep lying there is no shortage of Oxygen.  These aren't COVID deaths. These are MURDERS.
1388904022052990980,ICU Bed required. Please DM if any verified leads.   @Tejasvi_Surya @srivatsayb @Tej_AnanthKumar #SOSIYC #sosbangalore #covid #icu  https://t.co/SpX34Uub6Z
1388421119904862208,@sakshichand8TOI @Benarasiyaa @TOIDelhi @ShefVaidya @UnSubtleDesi  even batra hospital is lying similar to @bahardutt  and @BDUTT ... You can write a article decoding these lies by asking ambulance drivers or you can ask nursing staff of the hospital
1389443051966263299,Social media is rife with positive feedback for Bengaluru’s 108 and 1912 numbers. Our experience is that hospitals reject patients even with BBMP’s bed allocation. They dare us to file a complaint.
1389280567363981315,My Cousin who was in ICU has fully recovered and got discharged from the hospital today. Feeling so relieved. God is great 🙏🙏🙏
1388373991891488770,And vaccinations did begin for the 18-44 age group in #Karnataka. This is @BSYBJP with vaccine recipients at the government’s Bowring Hospital in #Bengaluru.  https://t.co/SEVUVlqF1P
1388448514598866952,* Useful Alerts *  ❇️ * Third phase of COVID-19 vaccination begins today; Everyone above 18 to get vaccinated *  ❇️ * Govt permits import of Oxygen concentrators for personal use *  ❇️ * First batch of the Russian COVID-19 vaccine Sputnik V to arrive in country today *
1388366761544740864,"@HospitalsApollo Where APOLLO HOSPITAL 1, BOMMANAHALLI, BBMP, KARNATAKA, .location?? It's totally confusing"
1389651350762377217,@Chinmay_2001 @AnkitPa84038991 #Lucknow  ICU beds and Ventilator beds available RR Sinha Hospital.  Contact - 9936052233  Verified - 10.00 PM (04/05/21)  (Pls verify once more before rushin)  Keep patient details before calling   #UttarPadesh #ICUBeds #Beds #VentilatorBeds #BedsAvailable #Verified #available
1389457522671579144,"When Media &amp; News channels can show the counts of elections 24/7.Then why they can’t show live updates about bed availability which will help citizens.  Even hospitals can’t do any scam in bed if media is showing live bed counts,Dose It will be a great initiative right?@INYParty"
1389794874283544585,@bhak_sala See if you can do something bhai.  Date 4/5/21 Name: Varsha Santwani  Age: 51 Blood group: A negative CT score: 12/25 Oxygen: 88 Admitted in: unique hospital Indore  Requirement: 2 unit plasma A- Attendant : Mr. Dishank Santwani  Number : 9977752500
1389541475910778880,We Need Oxygen Please...  #INCIndia #Oxygen #INCKarnataka @brnaidu1978 @Aslam_khader  https://t.co/7spnqBWmji
1388333098945769478,"Not every patient needs to get admitted to hospital, they can recover at home with proper guidance. Don't panic."
1389152806678892553,The visuals are from #Chamarajanagar hospitals in which volunteers from @PFIOfficial are assisting with the 24 bodies died out of having no oxygen.God save Karnataka from these incompetent leaders.This is nothing but murder.  #ResignYediyurappa  #COVID19  https://t.co/OaFzr9RLzF
1388414908136448004,"You risk your life going to hospital for  vaccination and wait in a queue for 2 hours and then when your turn comes , it’s shown that all the registrations are cancelled and you need to register again and schedule appointment.  @drharshvardhan @narendramodi @myogiadityanath"
1388928614956093440,"@IshitaYadav If we had controle over our population since independence....what can't be built , hospital statue everything!!!!!"
1389139932568981505,"@BSYBJP The condition in Blore is scary Sir. From last 24 hours we are searching for an ICU bed. The patient SPo2 level gone to 68 and on oxygen. Called 1912, spoke to BBMP ward office and called 108 multiple times. All saying will call back when ICU bed is made available"
1389430538394427393,@Ssaurabhkesari @satishkolar @BSYBJP @narendramodi @PMOIndia @AmitShah @drharshvardhan You expect ppl dying for lack of oxygen to have patience ??
1388392136727416834,@srishlee8march @ShreyaBhargava6 @Mufti_Yasir @ISHAJAI15961410 @cbic_india Bakwas tho har hospital me ho raha hai.
1389860566152351753,"@rohini_sgh Madam there was no dearth of oxygen in western countries ,why so many deaths I wonder! With oxygen ppl die that is not genocide? Our judiciary is a bunch of clowns &amp; use words like genocide without knowing the meaning!"
1389558034398019589,"@BoskyKhanna @DHFWKA @NewIndianXpress @XpressBengaluru @santwana99 @CovidKarnataka @NammaBengaluroo @koramangalares1 @KoramangalaRWA @_kanakapuraroad @namma_BTM @Namma_ORRCA Patient Mrs. Ravina  K/ Age-50yrs. Covid positive date - 27th April/ O2 level now- 86, Pulse 95/ Has fever, low oxygen and dropping pulse/ Area -HBR layout,Blr 560043 Looking for a hospital bed with oxygen, and ICU facility:Mob 9902867369 BU number:708587&amp;755867"
1388856323530391554,@Himanshu1687 @tharealkosmos Politicians bomb haktharhe oxygen collect madhkholhi
1389202122562949123,@RailMinIndia @IRCTCofficial passing of oxygen fast track mode !!! Hats of @RailMinIndia great job at Sojat Road railway crossing (Rajasthan)  https://t.co/R4jFhyxp5X
1389550408050233347,"Is anyone able to contact Rajiv Gandhi hospital, Jayanagar, Bangalore?  It is supposed to be allocated as a COVID hospital from today and beds are available. Not listed on BBMP website yet.   @WeAreBangalore @peakbengaluru"
1388710185250672645,@ImSimhaa @Raghu_Dixit @samyuktahornad Please help. Need Bed n Oxygen asap  https://t.co/qO8quxnW6l
1388566520582660100,@Ajay49168875 @TajinderBagga Twitter is best platform now ...in this oxygen crises Thanks to everyone  #OxygenEmergency
1389918335089790977,"ಚಾಮರಾಜನಗರ​ ಕೇಸ್; ಜಿಲ್ಲಾಧಿಕಾರಿ ಕಚೇರಿ, ಜಿಲ್ಲಾಸ್ಪತ್ರೆ ಸೇರಿ 5 ಸ್ಥಳಗಳಲ್ಲಿ ದಾಖಲೆ ಸೀಜ್   https://t.co/TiQucNhtGm  #Newsfirstlive #Chamarajanagar #Hospital #Documents #HighCourt"
1388324336549957635,"@mistshaa @shrav1512 Apologies, the helpline numbers say they aren't providing oxygen for home use. They only provide oxygen for hospital use. Will respond if I get through to someone else in the meantime."
1389933593728667652,OXY  level again dropped to 62.... Need VENTILATOR urgent please please please #SOSIYC
1388438839258017794,@roodiee18 @ComardSurya @SDhawan25 sahi kaha dhawan ne direct mission oxygen me diya hai lekin pat cumming aur bahi celebrity ne pm care fund me paisa barbad kar diya
1389890200268988420,"@Arijitdas123 #Verified by source on 5/5/21, 01:31 AM  01204723333 - Le Crest hospital Ghaziabad,  Oxygen beds available  Try this"
1390177516808146944,"@dhume The nearest Public Health Centre is the best bet. They have the max vaccine stocks that are replenished daily. Most are doing a fairly decent job of dispensing vaccines. Amongst the govt hospitals, Victoria Hospital/Bowring Hospital are good"
1389097411092508675,Today I saw a Huge Number of Oxygen Cylinders being transferred to a Hospital nearby me...Still because of somebody's negligence in ground-level people has to suffer ☹️☹️☹️
1388452476802584583,18 Covid Patients Dead In Fire At Gujarat Hospital: Report - NDTV  https://t.co/gNyL8TEXw6
1389882745015341058,"@Tejasvi_Surya @Offtejasvisurya @drashwathcn Oxygen supply and their suppliers - 1) Even they need a reality check, word is that black marketing is being done to gain unlawful profits in this pandemic time. 2) Demand and supply should be put into blockchain mechanism. 🙏😷"
1388366169623564291,@oxygenblr Patient name : Sreedevi Age :39 Recent SPO2 level:90 Hospital : home isolation  Doctor Name :Dr Venkatesh SRF id :2952511035149 BU No:632993 Attendant name: Venkatesh Area: Malleshwaram   OXYGEN CYLINDER REQUIRED
1389829790648070145,CJI: should we take it that all beds in govt hospital and 50% in pvt beds are with you... So if he doesn't go to apthamitra he doesn't get bed?   ex: a man test positive he doesn't get call from apthamitra but oxygen level drops to 75 if he goes to hospital he won't get bed?
1389141446368759811,"@narendramodi @AITCofficial @MamataOfficial @BJP4India @BJP4Bengal @JPNadda @AmitShah @narendramodi u all would not able to protect karyakarta n ground level in coming days &amp; predict that next 2026 election 0 seats will b n opposition party,38 % voters go 4 job medicine oxygen/flee @jdhankhar1 @rashtrapatibhvn protect us🙏"
1388588226206519297,@LegalKant @MEAIndia Govt has just allowed NRIs to gift oxygen cylinders in India.   https://t.co/8YH3ve9eZ1
1389573465271726082,"@Nainamishr94 All these vaccine slots for 18+ in Mohali is a  MAJOR glitch. If you call hospitals they will tell you they aren't EXPECTING vaccines for 18+ before Fri. They're  not even aware why these slots have been updated on Cowin. Verified at DH mohali, Sohana hsp and New life zrkpr today"
1389430043651108870,@KanganaTeam Iss tweet ke liye aapko jarur ek bed milegi in Ranchi mental hospital..... go and enjoy....
1390171969287593988,"The Central division police booked a case of bed-blocking at a private hospital and arrested three people, one of whom is an Arogya Mitra, for allegedly extorting ₹1.20 lakh from the son of a #COVID19 patient who later passed away   https://t.co/0kbJl2JY2k"
1388360595326472192,Eidhi foundation in Pakistan offers oxygen to India ... Now anyone blaming the govt for lack of oxygen can actually “Go to Pakistan “ #OxygenCylinders  #OxygenShortage #indiacovid #IndiaFightsCorona
1388765522116841478,"State Govt. Hospitals has not cooperated in establishing in-house Oxygen plants even after funds allotted by Govt., but preferred to buy Oxygen from private vendors REASON...? #corruption  #CoronaPandemic   https://t.co/AaNrph4rSw"
1389803069966217216," https://t.co/SXogF24Rj8  @Tejasvi_Surya @Offtejasvisurya @drashwathcn @mla_sudhakar @BBMPAdmn @BBMPCOMM @DVSadanandGowda @PCMohanMP @PCMohanMPOffice Govt can chip in to help Bangaloreans, as pvt hospitals cannot/would not function  sans profit for whatever reasons."
1388672305694318594,@DeependerSHooda Bhai rajasthan me bhi improve kara do service 2-4 km ki ambulance ke liye 10k le rahe log...cant you guys make a law regarding that
1389474709163499523,"Nitrogen, Oxygen ke chakkar me inka CO2 ho gaya!  https://t.co/jI34fKUsLn"
1389280820666331143,The value of trees is the essential resource for the value of Oxygen.
1389981381208334338,@Offtejasvisurya  Bangalore  NEED ICU BED URGENTLY  Name : Madhu  Age : 62 Covid + Admitted in Ms Ramiah  CALL 7022743007 or +91 76762 94755
1389138322627252225,@ammar_zaidi @tinucherian @nsitharaman @narendramodi @AmitShah @drharshvardhan Also if anyone has paid hospitals for Covid treatment should also be exempt from taxes...considering how much hospitals have billed during the pandemic
1389932883846991872,"@PMOIndia we should have the Indian Army @TheIndianArmy should take over the complete logistics and distribution of Medicines, Oxygen &amp; other medical equipment’s across the country. Building hospitals and Oxygen concentrators and all facilities. #Army4CovidFight in #India #Covid"
1388376138578202628,"A 30 years old required ventilator urgently in Bokaro, Oxygen level below 50. Please intervene @HemantSorenJMM @BannaGupta76 @The_NehaJoshi @srinivasiyc @BokaroDc @Offtejasvisurya"
1390118982238179333,"@RahulGandhi @RahulGandhi @MamataOfficial , sir please push for national emergency, the army has to be deployed both at hospitals and oxygen source locations. We as indians are failing."
1388817014337114112,"@sambitswaraj 1. Trump ignored Covid millions died, Trump lost 2. Modi Amit Shah ignoring Covid &amp; millions of Indians  DIEING  3. If Modi Amit Shah don't stop Covid then BJP LOSES 2024 LIKE BENGAL 4. To Win Central govt should give vaccine Covid medicines oxygen freely to all"
1389089648840871937,"Hospitals in Delhi started facing shortages of oxygen nearly two weeks ago. The crisis shows few signs of abating. One doctor described the situation as frightening, explaining: ""Once you've used up your main tank, there is nothing to fall back on.""😳  https://t.co/gmD7vmomOI"
1389416450566156288,@Swamy39 Sir 24 people have died in Chamarajnagar in KA. It is possibly due to short of oxygen supply. Can't we book all responsible persons under murder charge?
1390184956534480896,"During pandemic, India has come a long way. Heart breaking to see a lady who couldn't get an ICU bed for her father say that she could manage oxygen that helped him die breathing."
1389613201172488196,There's currently a black market for everything Covid-related right from a paracetamol tablet to an ICU bed in India.
1388731622699126785,"@TVMohandasPai @BSYBJP @drashwathcn @PCMohanMP @Tejasvi_Surya @iamanilshetty @kiranshaw @rk_misra Absolutely agree, those who can afford to pay more let people go to Pvt hospitals, for the economically weaker let them use Govt hospitals and PHC, give people the option"
1389804987098697728,ಸಕ್ಕರೆ ಕಾರ್ಖಾನೆ ಸ್ಥಗಿತಗೊಳಿಸಿ ಕೋವಿಡ್‌ ರೋಗಿಗಳಿಗೆ ಆಕ್ಸಿಜನ್‌ ನೀಡಲು ಸಿದ್ಧ | S...  https://t.co/dqtTuxnQ70 #SugarFactory #SRPatil #Oxygen
1389149855864524802,@BhavyaDhoni I am gonna cry now 😭😭😭today I made early morning shift to hospital so that I can watch match ( mind u I slept at 4 am after that space and went and 6 am just to watch match today )😪😭💔
1389496512116248580,@varinixg @spoosclues You will find all details here Rather than searching at multiple locations.   A telegram channel for checking Bengaluru Hospital Bed Status in real time.   _Share widely to help fellow citizens_   https://t.co/83tuVrPrIJ
1389100137037762561,"Need a bed with oxygen for my uncle. Name:G.Venkatesh Naidu, 65 yes, spo2 85, Vidyapeetha circle.  SRF: 295251082388 Bu_704482. Contact 9741377776. @DHFWKA @mla_sudhakar @NammaBengaluroo @WeAreBangalore"
1389966128181497865,"@hisudhir007 @NammaBengaluroo @CMofKarnataka @BSYBJP @mla_sudhakar @drashwathcn Bgs hospital covexin available 50 people daily please contact them, most of Pvt hospital resume from next week."
1389504172324573187,@abhivoice_ @28platypus @ParagGorghate @ManojMehra2610 @dhruv_rathee Naukar toh main kissi ka nhi bete.. Yeh aaya bhi kaha se? Where have you left your brains? Name the part of the ventilator which isn't man made? Price kaha se aaya?
1388736337017069568,"While IYC is helping lakhs of people, the head of BJP's Youth Wing is wasting time in TROLLING  @Tejasvi_Surya Foreign Embassies asked IYC for Oxygen and the IYC did it's duty.  Nobody asks you because they know neither you or the PM CARES!  INC saves lives. BJP ruins them."
1388472028756250627,"@SonuSood Sir, please arrange one oxygen cylinder, trying since morning to everywhere but no luck... please help 🙏"
1388298092168892418,"If your MLA or MP is not doing visits to hospitals everyday, don't vote them again."
1388543709973671940,*️⃣ Less experienced medical personnel would be identified and measures would be taken on their effective utilisation.  *️⃣ A suitable audit system would be implemented to avoid extensive and unnecessary utilisation of Remdesivir and oxygen in hospitals.  7/9
1389658604479807488,@Ras_hmi_Tweet @shembi79 We are struggling to get oxygen supply and hospital bed for our apartment security supervisor for past 2 days…
1389189091799953408,"@Sharada_naik @BSYBJP @mla_sudhakar Fake news... Bangalore hospitals have oxygen generation plants ... So, no chance of this happening"
1389509963601661955,@deb_stoned Such idiocy! Who was leading the policy? Who negotiated prices? Who placed orders? Who is responsible for this shit-show?  Who was the super spreader when people were dying without oxygen? May god never put you in that situation.
1389208874847141890,"Memo for Parliamentary Committees: In future, make lists. Like this:  1. Procure oxygen 2. Buy mushrooms. 3. Also vaccines 4. Build new palace for self.  More likely to get results that way."
1388527056250544134,@sindupdk @DVSadanandGowda @BSYBJP @DDChandanaNews @PIB_India @PIBBengaluru @BJP4Karnataka @nalinkateel @drashwathcn @mla_sudhakar Which hospital is doing such thing? Name the hospital here. Do not tell all hospital as generic answer.
1389231300092047361,@RockWithboAt donates Rs 50 lakh to procure high-grade oxygen concentrators and essential medical supplies for hospitals and COVID-care centres to aid with #COVID19 relief - in partnership with @savelifeindia and the Health Department. Via @news18dotcom  https://t.co/usJb8AxSF0  https://t.co/2C8D7jo50E
